[
  {
    "name": "echo",
    "description": "Return the given text verbatim.",
    "requires_approval": false,
    "read_only": true,
    "parameters": {
      "type": "object",
      "properties": {
        "text": { "type": "string" }
      },
      "required": ["text"]
    }
  },
  {
    "name": "run_code",
    "description": "Execute arbitrary code in a sandbox. Always requires human approval.",
    "requires_approval": true,
    "parameters": {
      "type": "object",
      "properties": {
        "language": { "type": "string", "enum": ["python", "javascript", "bash"] },
        "code": { "type": "string" },
        "timeout_seconds": { "type": "integer", "minimum": 1 }
      },
      "required": ["language", "code"]
    }
  },
  {
    "name": "web_search",
    "description": "Search the web and return top results. kind='web' for general web search, kind='news' for latest headlines, kind='wikipedia' for encyclopedia entries. Does not require approval.",
    "requires_approval": false,
    "read_only": true,
    "parameters": {
      "type": "object",
      "properties": {
        "query": { "type": "string", "minLength": 1 },
        "kind": { "type": "string", "enum": ["web", "news", "wikipedia"] },
        "max_results": { "type": "integer", "minimum": 1, "maximum": 10 }
      },
      "required": ["query"]
    }
  },
  {
    "name": "fetch_url",
    "description": "Fetch a URL and return its text content as trimmed plain text. Use when a search snippet is not enough and you need the actual page content. Does not require approval.",
    "requires_approval": false,
    "read_only": true,
    "parameters": {
      "type": "object",
      "properties": {
        "url": { "type": "string", "minLength": 1 },
        "max_chars": { "type": "integer", "minimum": 200, "maximum": 20000 }
      },
      "required": ["url"]
    }
  },
  {
    "name": "send_email",
    "description": "Send an email via SMTP (config: AGENT_CORE_SMTP_HOST / _PORT / _USER / _PASSWORD / _FROM; attachments resolve under AGENT_CORE_FILE_ROOT). Always requires human approval.",
    "requires_approval": true,
    "parameters": {
      "type": "object",
      "properties": {
        "to": { "type": "string" },
        "subject": { "type": "string" },
        "body": { "type": "string" },
        "attachments": { "type": "array", "items": { "type": "string" } }
      },
      "required": ["to", "subject", "body"]
    }
  },
  {
    "name": "send_message",
    "description": "Send a chat message to a messaging channel over the MCP remote (opt-in via MCP_BASE_URL). Always requires human approval.",
    "requires_approval": true,
    "parameters": {
      "type": "object",
      "properties": {
        "channel": { "type": "string", "enum": ["whatsapp", "telegram"] },
        "to": { "type": "string" },
        "text": { "type": "string" }
      },
      "required": ["channel", "to", "text"]
    }
  },
  {
    "name": "create_docx",
    "description": "Create a .docx document from a title and a list of sections.",
    "requires_approval": false,
    "parameters": {
      "type": "object",
      "properties": {
        "title": { "type": "string" },
        "sections": {
          "oneOf": [
            {
              "type": "array",
              "items": {
                "type": "object",
                "properties": {
                  "heading": { "type": "string" },
                  "body": {
                    "anyOf": [
                      { "type": "string" },
                      { "type": "array", "items": { "type": "string" } }
                    ]
                  }
                },
                "required": ["heading"]
              }
            },
            {
              "type": "object",
              "properties": {
                "heading": { "type": "string" },
                "body": {
                  "anyOf": [
                    { "type": "string" },
                    { "type": "array", "items": { "type": "string" } }
                  ]
                }
              },
              "required": ["heading"]
            }
          ]
        }
      },
      "required": ["title", "sections"]
    }
  },
  {
    "name": "create_pptx",
    "description": "Create a .pptx presentation from a title and a list of slides.",
    "requires_approval": false,
    "parameters": {
      "type": "object",
      "properties": {
        "title": { "type": "string" },
        "slides": {
          "oneOf": [
            {
              "type": "array",
              "items": {
                "type": "object",
                "properties": {
                  "title": { "type": "string" },
                  "bullets": {
                    "anyOf": [
                      { "type": "array", "items": { "type": "string" } },
                      { "type": "string" }
                    ]
                  }
                },
                "required": ["title"]
              }
            },
            {
              "type": "object",
              "properties": {
                "title": { "type": "string" },
                "bullets": {
                  "anyOf": [
                    { "type": "array", "items": { "type": "string" } },
                    { "type": "string" }
                  ]
                }
              },
              "required": ["title"]
            }
          ]
        }
      },
      "required": ["title", "slides"]
    }
  },
  {
    "name": "inspect_self",
    "description": "Return a live snapshot of the agent: name, session id, target, model, turn budget, estimated context usage, pending approval, current plan, and available tools. Does not require approval.",
    "requires_approval": false,
    "read_only": true,
    "parameters": {
      "type": "object",
      "properties": {},
      "required": []
    }
  },
  {
    "name": "remember",
    "description": "Save a fact, preference, or lesson to long-term memory so it persists across sessions. kind is one of: fact, preference, lesson, session_summary.",
    "requires_approval": false,
    "parameters": {
      "type": "object",
      "properties": {
        "key": { "type": "string", "minLength": 1 },
        "content": { "type": "string", "minLength": 1 },
        "kind": { "type": "string", "enum": ["fact", "preference", "lesson", "session_summary"] }
      },
      "required": ["key", "content"]
    }
  },
  {
    "name": "recall",
    "description": "Search long-term memory for entries matching a topic. Empty topic recalls the most recent memories.",
    "requires_approval": false,
    "read_only": true,
    "parameters": {
      "type": "object",
      "properties": {
        "topic": { "type": "string" },
        "limit": { "type": "integer", "minimum": 1, "maximum": 20 }
      },
      "required": []
    }
  },
  {
    "name": "make_plan",
    "description": "Set an explicit multi-step plan for the current task (goal + ordered step descriptions). Each step that calls a tool still requires normal approval. Does not require approval itself.",
    "requires_approval": false,
    "read_only": true,
    "parameters": {
      "type": "object",
      "properties": {
        "goal": { "type": "string", "minLength": 1 },
        "steps": {
          "type": "array",
          "items": { "type": "string", "minLength": 1 },
          "minItems": 1
        }
      },
      "required": ["goal", "steps"]
    }
  },
  {
    "name": "update_plan",
    "description": "Mark a plan step as in_progress, done, failed, or skipped (optionally with a short result).",
    "requires_approval": false,
    "read_only": true,
    "parameters": {
      "type": "object",
      "properties": {
        "step_id": { "type": "string", "minLength": 1 },
        "status": { "type": "string", "enum": ["pending", "in_progress", "done", "failed", "skipped"] },
        "result": { "type": "string" }
      },
      "required": ["step_id", "status"]
    }
  },
  {
    "name": "read_file",
    "description": "Read a UTF-8 text file under the allowed file root (AGENT_CORE_FILE_ROOT). Returns content, truncated to max_chars. Read-only.",
    "requires_approval": false,
    "read_only": true,
    "parameters": {
      "type": "object",
      "properties": {
        "path": { "type": "string", "minLength": 1 },
        "max_chars": { "type": "integer", "minimum": 1 }
      },
      "required": ["path"]
    }
  },
  {
    "name": "write_file",
    "description": "Create or overwrite a text file under the allowed file root. Atomic write; always requires human approval.",
    "requires_approval": true,
    "parameters": {
      "type": "object",
      "properties": {
        "path": { "type": "string", "minLength": 1 },
        "content": { "type": "string" }
      },
      "required": ["path", "content"]
    }
  },
  {
    "name": "edit_file",
    "description": "Replace one unique occurrence of old_string with new_string in a file under the allowed file root. Fails if old_string is absent or occurs more than once. Atomic write; always requires human approval.",
    "requires_approval": true,
    "parameters": {
      "type": "object",
      "properties": {
        "path": { "type": "string", "minLength": 1 },
        "old_string": { "type": "string", "minLength": 1 },
        "new_string": { "type": "string" }
      },
      "required": ["path", "old_string", "new_string"]
    }
  },
  {
    "name": "list_dir",
    "description": "List entries of a directory under the allowed file root (directories end with '/'). Read-only.",
    "requires_approval": false,
    "read_only": true,
    "parameters": {
      "type": "object",
      "properties": {
        "path": { "type": "string" }
      },
      "required": []
    }
  },
  {
    "name": "glob",
    "description": "Find paths under the allowed file root matching a glob pattern (e.g. 'core/*.py', '**/*.md'). Read-only.",
    "requires_approval": false,
    "read_only": true,
    "parameters": {